{
  "schema": "sg4.output.v1.1",
  "time_s": 80.0,
  "perclos": 0.0594,
  "face_valid": 1,
  "long_blinks": 0,
  "yawn_count": 0,
  "eye_closure_s": 0.0,
  "nod_count": 1,
  "validity_score": 1.0,
  "calibrating": false,
  "blink_rate_bpm": 17.0,
  "mean_blink_ms": 210,
  "slow_blinks": 0,
  "longest_closure_s": 0.3,
  "head_down_s": 0.4,
  "face_absent_s": 0.0,
  "perclos_vs_baseline": 1.009,
  "trend": "stable"
}
