{
  "schema": "sg4.output.v1.1",
  "time_s": 16.0,
  "perclos": 0.0312,
  "face_valid": 0,
  "long_blinks": 0,
  "yawn_count": 0,
  "eye_closure_s": 0.0,
  "nod_count": 0,
  "validity_score": 0.9356,
  "calibrating": true,
  "blink_rate_bpm": 12.03,
  "mean_blink_ms": 155,
  "slow_blinks": 0,
  "longest_closure_s": 0.2,
  "head_down_s": 0.0,
  "face_absent_s": 1.033,
  "perclos_vs_baseline": null,
  "trend": null
}
